{
  "schema_version":"history-v1",
  "history_entry_id":"2d931510-d99f-494a-8c67-87feb05e1594",
  "recorded_at_us":1780000000123456,
  "operation_outcome":"completed",
  "repository_label":"service",
  "workspaces":[{"workspace_id":"ws-npm-root","path":".","ecosystem":"npm","package_manager":"npm","discovery_completeness":"complete"}],
  "report":{"source_schema_version":"v1alpha","source_scan_id":"scan-a1b2c3d4","status":"complete","repository_state":"a1b2c3d4e5f67890a1b2c3d4e5f67890a1b2c3d4e5f67890a1b2c3d4e5f67890","provenance":{"deprail_version":null,"scanner_name":null,"scanner_version":null,"scanner_database_version":null},"findings":[{"stable_finding_key":"629c2d635fcf2c1b477bf527cde2fb15d587aa86abab81146c6aded0e2d37feb","component_name":"lodash","component_purl":"pkg:npm/lodash@4.17.20","version":"4.17.20","workspace_id":"ws-npm-root","relative_path":".","ecosystem":"npm","vulnerability_id":"GHSA-example","aliases":["CVE-2024-0001"],"severity":"high","fixed_version":"4.17.21"}],"artifact_digests":["0123456789abcdef0123456789abcdef0123456789abcdef0123456789abcdef"]},
  "diagnostics":[]
}
